{
  "$schema": "https://json-schema.org/draft/2020-12/schema",
  "$id": "https://continuouscoordination.org/schema/checkin.schema.json",
  "title": "Check-in",
  "description": "An individual's update within the ground-level coordination loop. Captures intentions, progress, and blockers to keep teammates in sync day-to-day or week-to-week.",
  "type": "object",
  "properties": {
    "id": {
      "type": "string",
      "description": "Unique identifier for this check-in."
    },
    "actor_id": {
      "type": "string",
      "description": "ID of the person or agent this check-in is for."
    },
    "actor_type": {
      "type": "string",
      "enum": ["person", "agent"],
      "description": "Whether the actor is a person or an agent."
    },
    "team_id": {
      "type": "string",
      "description": "ID of the team this check-in is for."
    },
    "date": {
      "type": "string",
      "format": "date",
      "description": "The date this check-in covers (ISO 8601)."
    },
    "next": {
      "type": "array",
      "items": {
        "type": "string"
      },
      "description": "Intentions -- what this person plans to work on. Communicating intent is a core practice: it lets leaders course-correct early and lets contributors drive progress autonomously."
    },
    "previously": {
      "type": "array",
      "items": {
        "type": "string"
      },
      "description": "Progress -- what this person accomplished since their last check-in."
    },
    "blockers": {
      "type": "array",
      "items": {
        "type": "string"
      },
      "description": "Anything preventing forward progress that needs attention from the team or leadership."
    },
    "created_at": {
      "type": "string",
      "format": "date-time",
      "description": "Timestamp when this check-in was submitted (ISO 8601)."
    }
  },
  "required": ["id", "actor_id", "actor_type", "team_id", "date"]
}
